
mysql> use invoice;
Database changed

mysql> show tables;
+-------------------+
| Tables_in_invoice |
+-------------------+
| customer          |
| invoice_item      |
| invoice_master    |
| product           |
+-------------------+
4 rows in set (0.12 sec)

mysql> select * from invoice_master;
+--------+---------+------------+
| inv_id | cust_id | inv_date   |
+--------+---------+------------+
| 100001 |    1003 | 2021-01-01 |
| 100010 |    1003 | 2021-01-23 |
| 100013 |    1002 | 2021-01-31 |
| 100021 |    1005 | 2021-02-14 |
| 100036 |    1001 | 2021-03-25 |
| 100040 |    1001 | 2021-04-12 |
| 100045 |    1004 | 2021-04-28 |
| 100050 |    1002 | 2021-05-04 |
+--------+---------+------------+
8 rows in set (0.07 sec)


-----delete invoice details of particular customer---------------------------------

mysql> delete from invoice_master where inv_id=100013;
Query OK, 1 row affected (0.24 sec)

mysql> select * from invoice_master;
+--------+---------+------------+
| inv_id | cust_id | inv_date   |
+--------+---------+------------+
| 100001 |    1003 | 2021-01-01 |
| 100010 |    1003 | 2021-01-23 |
| 100021 |    1005 | 2021-02-14 |
| 100036 |    1001 | 2021-03-25 |
| 100040 |    1001 | 2021-04-12 |
| 100045 |    1004 | 2021-04-28 |
| 100050 |    1002 | 2021-05-04 |
+--------+---------+------------+
7 rows in set (0.14 sec)